{
  "$schema": "https://json-schema.org/draft/2020-12/schema",
  "$id": "https://github.com/durable-workflow/.github/blob/main/beta-authorization/record-schema.json",
  "title": "Durable Workflow beta authorization",
  "type": "object",
  "additionalProperties": false,
  "required": ["schema", "channel", "candidate", "components"],
  "properties": {
    "schema": {
      "const": "durable-workflow.beta-authorization/v1"
    },
    "channel": {
      "const": "beta"
    },
    "candidate": {
      "type": "string",
      "pattern": "^[a-z0-9][a-z0-9._-]{0,55}$"
    },
    "components": {
      "type": "object",
      "additionalProperties": false,
      "required": [
        "workflow",
        "waterline",
        "server",
        "cli",
        "sdk-php",
        "sdk-python",
        "sdk-rust"
      ],
      "properties": {
        "workflow": { "$ref": "#/$defs/component" },
        "waterline": { "$ref": "#/$defs/component" },
        "server": { "$ref": "#/$defs/component" },
        "cli": { "$ref": "#/$defs/component" },
        "sdk-php": { "$ref": "#/$defs/component" },
        "sdk-python": { "$ref": "#/$defs/component" },
        "sdk-rust": { "$ref": "#/$defs/component" }
      }
    }
  },
  "$defs": {
    "component": {
      "type": "object",
      "additionalProperties": false,
      "required": ["version", "commit"],
      "properties": {
        "version": {
          "type": "string",
          "pattern": "^[0-9]+\\.[0-9]+\\.[0-9]+(?:[-+][0-9A-Za-z][0-9A-Za-z.-]*)?$"
        },
        "commit": {
          "type": "string",
          "pattern": "^[0-9a-f]{40}$"
        }
      }
    }
  }
}
